[
  {
    "dataId": "goblin_party",
    "enemyGridSize": "3,3",
    "playerGridSize": "3,3",
    "enemies": [
      {
        "characterId": "goblin",
        "aibehaviorid": "goblin_warrior",
        "position": "1,0"
      },
      {
        "characterId": "goblin",
        "aibehaviorid": "goblin_priest",
        "position": "1,1"
      },
      {
        "characterId": "goblin",
        "aibehaviorid": "goblin_warrior",
        "position": "0,0"
      }
    ]
  }
]
